"Release.Date";"Season";"Episode";"Episode.Title";"Name";"Sentence"
"2019-04-28";"Season 8";"Episode 3";"The Long Night";"theon greyjoy";"steady now. make every shot count."
"2019-04-28";"Season 8";"Episode 3";"The Long Night";"man";"over there!"
"2019-04-28";"Season 8";"Episode 3";"The Long Night";"man";"there!"
"2019-04-28";"Season 8";"Episode 3";"The Long Night";"jon snow";"get off!"
"2019-04-28";"Season 8";"Episode 3";"The Long Night";"daenerys targaryen";"dracarys."
"2019-04-28";"Season 8";"Episode 3";"The Long Night";"tyrion lannister";"come on! come on! no! no, no, no!"
"2019-04-28";"Season 8";"Episode 3";"The Long Night";"jon snow";"bran!"
"2019-04-28";"Season 8";"Episode 3";"The Long Night";"daenerys targaryen";"go!"
"2019-04-28";"Season 8";"Episode 3";"The Long Night";"daenerys targaryen";"jorah!"
"2019-04-28";"Season 8";"Episode 3";"The Long Night";"bran stark";"theon."
"2019-04-28";"Season 8";"Episode 3";"The Long Night";"bran stark";"you are a good man."
"2019-04-28";"Season 8";"Episode 3";"The Long Night";"bran stark";"thank you."
"2019-04-28";"Season 8";"Episode 3";"The Long Night";"jorah mormont";"i am hurt."
"2019-05-05";"Season 8";"Episode 4";"The Last of the Starks";"jon snow";"we are here to say goodbye to our brothers and sisters. to our fathers and mothers. to our friends. our fellow men and women who set aside their differences to fight together and die together so that others might live. everyone in this world owes them a debt that can never be repaid. it is our duty and our honor to keep them alive in memory for those who come after us and those who come after them for as long as men draw breath. they  the shields that guarded the realms of men. and we shall never see their like again."
"2019-05-05";"Season 8";"Episode 4";"The Last of the Starks";"man";"to your health."
"2019-05-05";"Season 8";"Episode 4";"The Last of the Starks";"gendry baratheon";"have you seen arya?"
"2019-05-05";"Season 8";"Episode 4";"The Last of the Starks";"sandor clegane";"you can still smell the burning bodies, and that is where your head is at."
"2019-05-05";"Season 8";"Episode 4";"The Last of the Starks";"gendry baratheon";"i just want to thank her for-"
"2019-05-05";"Season 8";"Episode 4";"The Last of the Starks";"sandor clegane";"i am sure you do."
"2019-05-05";"Season 8";"Episode 4";"The Last of the Starks";"gendry baratheon";"look, it is not about that."
"2019-05-05";"Season 8";"Episode 4";"The Last of the Starks";"sandor clegane";"of course it is about that, you twat. why should not it be? the dead are dead. you are not."
"2019-05-05";"Season 8";"Episode 4";"The Last of the Starks";"daenerys targaryen";"gendry."
"2019-05-05";"Season 8";"Episode 4";"The Last of the Starks";"daenerys targaryen";"that is right, is not it?"
"2019-05-05";"Season 8";"Episode 4";"The Last of the Starks";"gendry baratheon";"yes, your grace."
"2019-05-05";"Season 8";"Episode 4";"The Last of the Starks";"daenerys targaryen";"you are robert baratheon's son."
"2019-05-05";"Season 8";"Episode 4";"The Last of the Starks";"daenerys targaryen";"you are aware he took my family's throne and tried to have me murdered?"
"2019-05-05";"Season 8";"Episode 4";"The Last of the Starks";"gendry baratheon";"i did not even know he was my father until after he was dead."
"2019-05-05";"Season 8";"Episode 4";"The Last of the Starks";"daenerys targaryen";"yes, he is dead. his brothers are too. so who is lord of storm's end now?"
"2019-05-05";"Season 8";"Episode 4";"The Last of the Starks";"gendry baratheon";"i do not know, your grace."
"2019-05-05";"Season 8";"Episode 4";"The Last of the Starks";"daenerys targaryen";"does anyone?"
"2019-05-05";"Season 8";"Episode 4";"The Last of the Starks";"daenerys targaryen";"i think you should be lord of storm's end."
"2019-05-05";"Season 8";"Episode 4";"The Last of the Starks";"gendry baratheon";"i can not be. i am a bastard."
"2019-05-05";"Season 8";"Episode 4";"The Last of the Starks";"daenerys targaryen";"no, you are lord gendry baratheon of storm's end, the lawful son of robert baratheon. because that is what i have made you."
"2019-05-05";"Season 8";"Episode 4";"The Last of the Starks";"davos";"to lord gendry baratheon of storm's end."
"2019-05-05";"Season 8";"Episode 4";"The Last of the Starks";"all";"to gendry!"
"2019-05-05";"Season 8";"Episode 4";"The Last of the Starks";"man";"lord gendry!"
"2019-05-05";"Season 8";"Episode 4";"The Last of the Starks";"man";"gendry!"
"2019-05-05";"Season 8";"Episode 4";"The Last of the Starks";"man";"that is easy, is not it?"
"2019-05-05";"Season 8";"Episode 4";"The Last of the Starks";"tyrion lannister";"a fitting reward for a hero."
"2019-05-05";"Season 8";"Episode 4";"The Last of the Starks";"sam";"uh, hold on."
"2019-05-05";"Season 8";"Episode 4";"The Last of the Starks";"tyrion lannister";"and a lord of storm's end who will be forever loyal to you."
"2019-05-05";"Season 8";"Episode 4";"The Last of the Starks";"man";"come, my lord."
"2019-05-05";"Season 8";"Episode 4";"The Last of the Starks";"daenerys targaryen";"see? you are not the only one who is clever."
"2019-05-05";"Season 8";"Episode 4";"The Last of the Starks";"woman";"i have to go down and get another barrel."
"2019-05-05";"Season 8";"Episode 4";"The Last of the Starks";"jaime lannister";"we fought dead things and lived to talk about it. if this is not the time to drink, when is?"
"2019-05-05";"Season 8";"Episode 4";"The Last of the Starks";"davos";"the last time i saw her, i told her i would kill her if i ever saw her again."
"2019-05-05";"Season 8";"Episode 4";"The Last of the Starks";"tyrion lannister";"i am sure you had your reasons."
"2019-05-05";"Season 8";"Episode 4";"The Last of the Starks";"davos";"i did. i do."
"2019-05-05";"Season 8";"Episode 4";"The Last of the Starks";"tyrion lannister";"so did you?"
"2019-05-05";"Season 8";"Episode 4";"The Last of the Starks";"davos";"never got the chance. she did it to herself. or her god did it to her. lord of light. we play his game for him, we fight his war and win, and then he fucks off. no signs, no blessings. who knows what he wants?"
"2019-05-05";"Season 8";"Episode 4";"The Last of the Starks";"tyrion lannister";"i do not imagine thinking about that subject will leave you any happier than before."
"2019-05-05";"Season 8";"Episode 4";"The Last of the Starks";"davos";"and what if i am not trying to be happy?"
"2019-05-05";"Season 8";"Episode 4";"The Last of the Starks";"tyrion lannister";"then you are in luck. we may have defeated them, but we still have us to contend with."
"2019-05-05";"Season 8";"Episode 4";"The Last of the Starks";"davos";"thank you. i feel much better."
"2019-05-05";"Season 8";"Episode 4";"The Last of the Starks";"man";"more ale!"
"2019-05-05";"Season 8";"Episode 4";"The Last of the Starks";"tyrion lannister";"this is clever. even better than the saddle i designed for you."
"2019-05-05";"Season 8";"Episode 4";"The Last of the Starks";"bran stark";"it is the same as the one daeron targaryen built for his crippled nephew 120 years ago. i liked that one."
"2019-05-05";"Season 8";"Episode 4";"The Last of the Starks";"tyrion lannister";"you know our history better than anyone. that will be useful as lord of winterfell."
"2019-05-05";"Season 8";"Episode 4";"The Last of the Starks";"bran stark";"i am not lord of winterfell."
"2019-05-05";"Season 8";"Episode 4";"The Last of the Starks";"tyrion lannister";"you are the only surviving trueborn son of ned stark."
"2019-05-05";"Season 8";"Episode 4";"The Last of the Starks";"tyrion lannister";"you do not want it."
"2019-05-05";"Season 8";"Episode 4";"The Last of the Starks";"bran stark";"i do not really want anymore."
"2019-05-05";"Season 8";"Episode 4";"The Last of the Starks";"tyrion lannister";"i envy you."
"2019-05-05";"Season 8";"Episode 4";"The Last of the Starks";"bran stark";"you should not envy me. mostly i live in the past."
"2019-05-12";"Season 8";"Episode 5";"The Bells";"varys";"come in."
"2019-05-12";"Season 8";"Episode 5";"The Bells";"varys";"and?"
"2019-05-12";"Season 8";"Episode 5";"The Bells";"varys";"nothing?"
"2019-05-12";"Season 8";"Episode 5";"The Bells";"martha";"she will not eat."
"2019-05-12";"Season 8";"Episode 5";"The Bells";"varys";"we will try again at supper."
"2019-05-12";"Season 8";"Episode 5";"The Bells";"martha";"i think they are watching me."
"2019-05-12";"Season 8";"Episode 5";"The Bells";"varys";"who?"
"2019-05-12";"Season 8";"Episode 5";"The Bells";"martha";"her soldiers."
"2019-05-12";"Season 8";"Episode 5";"The Bells";"varys";"of course they are. that is their job."
"2019-05-12";"Season 8";"Episode 5";"The Bells";"varys";"what have i told you, martha?"
"2019-05-12";"Season 8";"Episode 5";"The Bells";"martha";"the greater the risk, the greater the reward."
"2019-05-12";"Season 8";"Episode 5";"The Bells";"varys";"go on. they will be missing you in the kitchen."
"2019-05-12";"Season 8";"Episode 5";"The Bells";"varys";"the northern armies?"
"2019-05-12";"Season 8";"Episode 5";"The Bells";"jon snow";"just crossed the trident. they will be at the walls of king's landing in two days. how is she?"
"2019-05-12";"Season 8";"Episode 5";"The Bells";"varys";"she has not seen anyone since we returned. has not left her chambers, has not accepted any food."
"2019-05-12";"Season 8";"Episode 5";"The Bells";"jon snow";"she should not be alone."
"2019-05-12";"Season 8";"Episode 5";"The Bells";"varys";"you are worried for her. i admire your empathy."
"2019-05-12";"Season 8";"Episode 5";"The Bells";"jon snow";"are not you worried for her?"
"2019-05-12";"Season 8";"Episode 5";"The Bells";"varys";"i am worried for all of us. they say every time a targaryen is born, the gods toss a coin and the world holds  breath."
"2019-05-12";"Season 8";"Episode 5";"The Bells";"jon snow";"we are not much for riddles where i am from."
"2019-05-12";"Season 8";"Episode 5";"The Bells";"varys";"we both know what she is about to do."
"2019-05-12";"Season 8";"Episode 5";"The Bells";"jon snow";"that is her decision to make. she is our queen."
"2019-05-12";"Season 8";"Episode 5";"The Bells";"varys";"men decide where power resides, whether or not they know it."
"2019-05-12";"Season 8";"Episode 5";"The Bells";"jon snow";"what do you want?"
"2019-05-12";"Season 8";"Episode 5";"The Bells";"varys";"all i have ever wanted. the right ruler on the iron throne. i still do not know how her coin has landed. but i am quite certain about yours."
"2019-05-12";"Season 8";"Episode 5";"The Bells";"jon snow";"i do not want it. i never have."
"2019-05-12";"Season 8";"Episode 5";"The Bells";"varys";"i have known more kings and queens than any man living. i have heard what they say to crowds, and seen what they do in the shadows. i have furthered their designs, however horrible. but what i tell you now is true"
"2019-05-12";"Season 8";"Episode 5";"The Bells";"jon snow";"she is my queen."
"2019-05-12";"Season 8";"Episode 5";"The Bells";"tyrion lannister";"your grace?"
"2019-05-12";"Season 8";"Episode 5";"The Bells";"tyrion lannister";"there is something you need to know."
"2019-05-12";"Season 8";"Episode 5";"The Bells";"daenerys targaryen";"someone has betrayed me."
"2019-05-12";"Season 8";"Episode 5";"The Bells";"tyrion lannister";"yes."
"2019-05-12";"Season 8";"Episode 5";"The Bells";"daenerys targaryen";"jon snow."
"2019-05-12";"Season 8";"Episode 5";"The Bells";"tyrion lannister";"varys."
"2019-05-12";"Season 8";"Episode 5";"The Bells";"daenerys targaryen";"he knows the truth about jon."
"2019-05-12";"Season 8";"Episode 5";"The Bells";"tyrion lannister";"he does."
"2019-05-12";"Season 8";"Episode 5";"The Bells";"daenerys targaryen";"because you told him. you learned from sansa. and she learned from jon, though i begged him not to tell her. as i said, he betrayed me."
"2019-05-12";"Season 8";"Episode 5";"The Bells";"tyrion lannister";"i am glad sansa told me. i am your hand. i need to be aware of any threats you are facing."
"2019-05-12";"Season 8";"Episode 5";"The Bells";"daenerys targaryen";"and varys?"
"2019-05-12";"Season 8";"Episode 5";"The Bells";"tyrion lannister";"your master of whisperers needs to be aware too."
"2019-05-12";"Season 8";"Episode 5";"The Bells";"daenerys targaryen";"you spoke to him first. without coming to me. without asking my permission."
"2019-05-12";"Season 8";"Episode 5";"The Bells";"tyrion lannister";"it was a mistake."
"2019-05-12";"Season 8";"Episode 5";"The Bells";"daenerys targaryen";"why do you think sansa told you? what do you think she hoped to gain?"
"2019-05-12";"Season 8";"Episode 5";"The Bells";"tyrion lannister";"she trusts me."
"2019-05-12";"Season 8";"Episode 5";"The Bells";"daenerys targaryen";"yes, she trusts you. she trusted you to spread secrets that could destroy your own queen. and you did not let her down."
"2019-05-12";"Season 8";"Episode 5";"The Bells";"tyrion lannister";"if i have failed you, my queen, forgive me. our intentions  good. we wanted what you want. a better world, all of us. varys as much as anyone."
"2019-05-12";"Season 8";"Episode 5";"The Bells";"tyrion lannister";"but it does not matter now."
"2019-05-12";"Season 8";"Episode 5";"The Bells";"daenerys targaryen";"no. it does not matter now."
"2019-05-12";"Season 8";"Episode 5";"The Bells";"tyrion lannister";"it was me."
"2019-05-12";"Season 8";"Episode 5";"The Bells";"varys";"i hope i deserve this. truly, i do. i hope i am wrong. goodbye, old friend."
"2019-05-12";"Season 8";"Episode 5";"The Bells";"daenerys targaryen";"lord varys. i, daenerys of house targaryen, first of my name, breaker of chains and mother of dragons ..."
"2019-05-12";"Season 8";"Episode 5";"The Bells";"daenerys targaryen";"sentence you to die. dracarys."
"2019-05-12";"Season 8";"Episode 5";"The Bells";"daenerys targaryen";"this was all she brought with her when we crossed the narrow sea. her only possession."
"2019-05-12";"Season 8";"Episode 5";"The Bells";"daenerys targaryen";"it is all right, torgo nudo. let me speak with him."
"2019-05-12";"Season 8";"Episode 5";"The Bells";"daenerys targaryen";"what did i say would happen if you told your sister?"
"2019-05-12";"Season 8";"Episode 5";"The Bells";"jon snow";"i do not want it, and that is what i told him."
"2019-05-12";"Season 8";"Episode 5";"The Bells";"daenerys targaryen";"she betrayed your trust. she killed varys as much as i did. this was a victory for her. now she knows what happens when people hear the truth about you. far more people in westeros love you than love me. i do not have love here. i only have fear."
"2019-05-12";"Season 8";"Episode 5";"The Bells";"jon snow";"i love you. and you will always be my queen."
"2019-05-12";"Season 8";"Episode 5";"The Bells";"daenerys targaryen";"is that all i am to you? your queen?"
"2019-05-12";"Season 8";"Episode 5";"The Bells";"daenerys targaryen";"all right, then."
"2019-05-12";"Season 8";"Episode 5";"The Bells";"daenerys targaryen";"let it be fear."
"2019-05-12";"Season 8";"Episode 5";"The Bells";"tyrion lannister";"the people who live there, they are not your enemies. they are innocents, like the ones you liberated in meereen."
"2019-05-12";"Season 8";"Episode 5";"The Bells";"daenerys targaryen";"in meereen, the slaves turned on the masters and liberated the city themselves the moment i arrived."
"2019-05-12";"Season 8";"Episode 5";"The Bells";"tyrion lannister";"they are afraid. anyone who resists cersei will see his family butchered. you can not expect them to be heroes. they are hostages."
"2019-05-12";"Season 8";"Episode 5";"The Bells";"daenerys targaryen";"they are. in a tyrant's grip. whose fault is that? mine?"
"2019-05-12";"Season 8";"Episode 5";"The Bells";"tyrion lannister";"what does it matter whose fault it is? thousands of children will die if the city burns."
"2019-05-12";"Season 8";"Episode 5";"The Bells";"daenerys targaryen";"your sister knows how to use her enemies' weaknesses against them. that is what she thinks our mercy is - weakness."
"2019-05-12";"Season 8";"Episode 5";"The Bells";"tyrion lannister";"i beg you, my queen-"
"2019-05-12";"Season 8";"Episode 5";"The Bells";"daenerys targaryen";"but she is wrong. mercy is our strength. our mercy towards future generations who will never again be held hostage by a tyrant."
"2019-05-12";"Season 8";"Episode 5";"The Bells";"daenerys targaryen";"ready the unsullied. tonight you sail for king's landing, to join the northern armies."
"2019-05-12";"Season 8";"Episode 5";"The Bells";"tyrion lannister";"cersei's followers will abandon her if they know the war is lost. give them that chance. if the city surrenders, they will ring the bells and raise the gates. please, if you hear them ringing the bells, call off the attack."
"2019-05-12";"Season 8";"Episode 5";"The Bells";"daenerys targaryen";"wait for me outside the city. you will know when it is time."
"2019-05-12";"Season 8";"Episode 5";"The Bells";"daenerys targaryen";"your brother was stopped trying to get past our lines."
"2019-05-12";"Season 8";"Episode 5";"The Bells";"daenerys targaryen";"it seems he has not abandoned your sister after all. the next time you fail me will be the last time you fail me."
"2019-05-12";"Season 8";"Episode 5";"The Bells";"guard";"let them pass."
"2019-05-12";"Season 8";"Episode 5";"The Bells";"guard";"through the gate."
"2019-05-12";"Season 8";"Episode 5";"The Bells";"guard";"get going."
"2019-05-12";"Season 8";"Episode 5";"The Bells";"davos";"the rearguard should be here by daybreak."
"2019-05-12";"Season 8";"Episode 5";"The Bells";"tyrion lannister";"she wants to attack now."
"2019-05-12";"Season 8";"Episode 5";"The Bells";"jon snow";"daybreak at the earliest."
"2019-05-12";"Season 8";"Episode 5";"The Bells";"soldier";"careful with that."
"2019-05-12";"Season 8";"Episode 5";"The Bells";"soldier";"my lord."
"2019-05-12";"Season 8";"Episode 5";"The Bells";"tyrion lannister";"davos. i need to ask you a favor. you are the greatest smuggler alive, are not you?"
"2019-05-12";"Season 8";"Episode 5";"The Bells";"davos";"i am not gonna like this favor, am i?"
"2019-05-12";"Season 8";"Episode 5";"The Bells";"soldier";"he is always better when he is got some food in him."
"2019-05-12";"Season 8";"Episode 5";"The Bells";"soldier";"problem is when he is got drink in him. see what he did the other week?"
"2019-05-12";"Season 8";"Episode 5";"The Bells";"soldier";"aye. fighting as . commander nearly caught him."
"2019-05-12";"Season 8";"Episode 5";"The Bells";"soldier";"ay up. where you going?"
"2019-05-12";"Season 8";"Episode 5";"The Bells";"arya stark";"i am arya stark. i am going to kill queen cersei."
"2019-05-12";"Season 8";"Episode 5";"The Bells";"sandor clegane";"think about it. she kills cersei, the war's over. there will not be a siege. you might not even die tomorrow."
"2019-05-12";"Season 8";"Episode 5";"The Bells";"soldier";"i need to go talk to my captain."
"2019-05-12";"Season 8";"Episode 5";"The Bells";"sandor clegane";"go ahead, talk to him."
"2019-05-12";"Season 8";"Episode 5";"The Bells";"soldier";"where is he going?"
"2019-05-12";"Season 8";"Episode 5";"The Bells";"tyrion lannister";"i drink to eat the skull keeper."
"2019-05-12";"Season 8";"Episode 5";"The Bells";"tyrion lannister";"i want to eat the skull keeper."
"2019-05-12";"Season 8";"Episode 5";"The Bells";"tyrion lannister";"i want to see the ..."
"2019-05-12";"Season 8";"Episode 5";"The Bells";"unsullied";"we speak the common tongue."
"2019-05-12";"Season 8";"Episode 5";"The Bells";"tyrion lannister";"ah. good. i want to be alone with the prisoner. get some rest. tomorrow will be a long day."
"2019-05-12";"Season 8";"Episode 5";"The Bells";"unsullied";"we have orders to guard the prisoner."
"2019-05-12";"Season 8";"Episode 5";"The Bells";"tyrion lannister";"ordered by whom? the queen herself?"
"2019-05-12";"Season 8";"Episode 5";"The Bells";"unsullied";"no."
"2019-05-12";"Season 8";"Episode 5";"The Bells";"tyrion lannister";" , in that case, as hand of the queen, i outrank whomever gave your order. probably by quite a lot."
"2019-05-12";"Season 8";"Episode 5";"The Bells";"tyrion lannister";"how did they find you?"
"2019-05-12";"Season 8";"Episode 5";"The Bells";"tyrion lannister";"did you consider taking it off?"
"2019-05-12";"Season 8";"Episode 5";"The Bells";"jaime lannister";"cersei once called me ""the stupidest lannister."""
"2019-05-12";"Season 8";"Episode 5";"The Bells";"tyrion lannister";"and you are going back to her, to die with her."
"2019-05-12";"Season 8";"Episode 5";"The Bells";"jaime lannister";"you have underestimated her before."
"2019-05-12";"Season 8";"Episode 5";"The Bells";"tyrion lannister";"she is going to die. unless you can convince her to change her course of action."
"2019-05-12";"Season 8";"Episode 5";"The Bells";"jaime lannister";"difficult to do from here."
"2019-05-12";"Season 8";"Episode 5";"The Bells";"jaime lannister";"when have i ever been able to convince cersei of anything?"
"2019-05-12";"Season 8";"Episode 5";"The Bells";"tyrion lannister";"try. if not for yourself, if not for her, then for every one of the million people in that city, innocent or otherwise."
"2019-05-12";"Season 8";"Episode 5";"The Bells";"jaime lannister";"to be honest, i never really cared much for them. innocent or otherwise."
"2019-05-12";"Season 8";"Episode 5";"The Bells";"tyrion lannister";"you do care for one innocent. i know you do. and so does cersei. she has a reason now."
"2019-05-12";"Season 8";"Episode 5";"The Bells";"jaime lannister";"the child is the reason she will never give an inch. all the worst things she is ever done, she is done for her children. it is not impossible that she will win."
"2019-05-12";"Season 8";"Episode 5";"The Bells";"tyrion lannister";"she will not. her enemy's forces have been depleted, as she said they would be."
"2019-05-12";"Season 8";"Episode 5";"The Bells";"jaime lannister";"two of the three dragons are dead. she is evened the odds."
"2019-05-12";"Season 8";"Episode 5";"The Bells";"tyrion lannister";"the city will fall tomorrow."
"2019-05-12";"Season 8";"Episode 5";"The Bells";"jaime lannister";"she has the lannister army, she has the golden company-"
"2019-05-12";"Season 8";"Episode 5";"The Bells";"tyrion lannister";"i defended the city last time it was attacked. i know it better than anyone. it will fall tomorrow."
"2019-05-12";"Season 8";"Episode 5";"The Bells";"jaime lannister";"then i suppose i will die tomorrow, if not before."
"2019-05-12";"Season 8";"Episode 5";"The Bells";"tyrion lannister";"why?"
"2019-05-12";"Season 8";"Episode 5";"The Bells";"tyrion lannister";"escape. the two of you, together. remember where we met, where they keep the dragon skulls, beneath the red keep? take her down there. keep following the stairways down, down as far as they will go. you will come out onto a beach at the foot of the keep. a dinghy will be waiting for you. sail out of the bay. if the winds are kind, you will make it to pentos. start a new life."
"2019-05-12";"Season 8";"Episode 5";"The Bells";"jaime lannister";"sail right past the iron fleet and into a new life? sounds a lot less likely than cersei winning this war-"
"2019-05-12";"Season 8";"Episode 5";"The Bells";"tyrion lannister";"there will not be an iron fleet for much longer. do it. if you do not, you will never see cersei again."
"2019-05-12";"Season 8";"Episode 5";"The Bells";"tyrion lannister";"swear to me."
"2019-05-12";"Season 8";"Episode 5";"The Bells";"jaime lannister";"you have my word."
"2019-05-12";"Season 8";"Episode 5";"The Bells";"tyrion lannister";"if it works, give the order to ring all the bells in king's landing and open the gates. that will be our signal that the city has surrendered."
"2019-05-12";"Season 8";"Episode 5";"The Bells";"jaime lannister";"i will try."
"2019-05-12";"Season 8";"Episode 5";"The Bells";"tyrion lannister";"i never thought i would get to repay the favor. remember, ring the bells and open the gates."
"2019-05-12";"Season 8";"Episode 5";"The Bells";"jaime lannister";"your queen will execute you for this."
"2019-05-12";"Season 8";"Episode 5";"The Bells";"tyrion lannister";"if daenerys can make it to the throne without wading through a river of blood, maybe she will show mercy to the person who made that possible."
"2019-05-12";"Season 8";"Episode 5";"The Bells";"tyrion lannister";"tens of thousands of innocent lives one not particularly innocent dwarf it seems like a fair trade. if it  not for you, i never wouldo ve survived my childhood."
"2019-05-12";"Season 8";"Episode 5";"The Bells";"jaime lannister";"you would have."
"2019-05-12";"Season 8";"Episode 5";"The Bells";"tyrion lannister";"you  the only one who did not treat me like a monster. you  all i had."
"2019-05-12";"Season 8";"Episode 5";"The Bells";"soldier";"eyes on the horizon!"
"2019-05-12";"Season 8";"Episode 5";"The Bells";"soldier";"load the scorpion!"
"2019-05-12";"Season 8";"Episode 5";"The Bells";"soldier";"archers, close up!"
"2019-05-12";"Season 8";"Episode 5";"The Bells";"man";"come on!"
"2019-05-12";"Season 8";"Episode 5";"The Bells";"soldier";"up to the espringal!"
"2019-05-12";"Season 8";"Episode 5";"The Bells";"soldier";"to the back of it!"
"2019-05-12";"Season 8";"Episode 5";"The Bells";"soldier";"archers, line up!"
"2019-05-12";"Season 8";"Episode 5";"The Bells";"woman";"this way! come on!"
"2019-05-12";"Season 8";"Episode 5";"The Bells";"soldier";"clear the streets now!"
"2019-05-12";"Season 8";"Episode 5";"The Bells";"woman";"no!"
"2019-05-12";"Season 8";"Episode 5";"The Bells";"man";"in, now. and you, come on."
"2019-05-12";"Season 8";"Episode 5";"The Bells";"soldier";"inside, now!"
"2019-05-12";"Season 8";"Episode 5";"The Bells";"man";"quickly."
"2019-05-12";"Season 8";"Episode 5";"The Bells";"soldier";"yes. follow down there. they are here. get to the red keep."
"2019-05-12";"Season 8";"Episode 5";"The Bells";"father";"my son!"
"2019-05-12";"Season 8";"Episode 5";"The Bells";"soldier";"get inside!"
"2019-05-12";"Season 8";"Episode 5";"The Bells";"man";"just ahead of you, i can see it!"
