"","Name","Release.Date","season_name_first_apperance","episode_name_first_apperance","Sentence","lemma","tokens","episode_of_first_apperance","season_name_death","episode_name_death","How","episode_of_death","Allegiances","Gender","Nobility","Dead"
"87","rickard karstark","2011-06-19","Season 1","Fire and Blood","l'll have peace on those terms. they can keep their red castle and their iron chair too. the king in the north!","l'll peace term keep red castle iron chair king north","[""l'll"", 'peace', 'term', 'keep', 'red', 'castle', 'iron', 'chair', 'king', 'north']",10,"season 3","kissed by fire","beheaded by rob stark with a sword for treason.",25,"Stark",1,1,1
"88","rickon stark","2011-06-19","Season 1","Fire and Blood","here, shaggydog.","shaggydog","['shaggydog']",10,"season 6","battle of the bastards","shot through the back with an arrow by ramsay bolton, during the battle of the bastards.",59,"House Stark",1,1,1
"89","robb stark","2011-04-17","Season 1","Winter is Coming","relax your bow arm.","relax bow arm","['relax', 'bow', 'arm']",1,"season 3","the rains of castamere","stabbed in the chest by roose bolton at the red wedding. his death was orchestrated by tywin lannister, who agreed to name roose bolton warden of the north in return.",29,"House Stark",1,1,1
"90","robert baratheon","2011-04-17","Season 1","Winter is Coming","you have got fat.","got fat","['got', 'fat']",1,"season 1","you win or you die","mortally wounded by a boar after drinking too much wine purposely given to him by lancel lannister, orchestrated by cersei.",7,"House Baratheon",1,1,1
"91","robett glover","2017-07-23","Season 7","Stormborn","we called your brother king, and then he rode south and lost his kingdom.","called brother king rode south lost kingdom","['called', 'brother', 'king', 'rode', 'south', 'lost', 'kingdom']",62,NA,NA,NA,NA,"Stark",1,1,0
"92","rodrik cassel","2011-05-15","Season 1","The Wolf and the Lion","should i gag him?","gag","['gag']",5,"season 2","the old gods and the new","beheaded by theon greyjoy with a sword, at dagmers orders.",16,"Stark",1,1,1
"93","roose bolton","2012-04-22","Season 2","Garden of Bones","five lannisters dead for every one of ours. they are dead. take everything they have got. we have nowhere to keep all these prisoners. barely enough food to feed our own.","five lannisters dead every one dead take everything got nowhere keep prisoner barely enough food feed","['five', 'lannisters', 'dead', 'every', 'one', 'dead', 'take', 'everything', 'got', 'nowhere', 'keep', 'prisoner', 'barely', 'enough', 'food', 'feed']",14,"season 6","home","stabbed in the abdomen by his son ramsay bolton with a dagger, so that ramsay would become the new warden of the north.",52,"Stark",1,1,1
"94","rorge","2012-04-08","Season 2","The Night Lands","give us a beer. before i skin you.","give u beer skin","['give', 'u', 'beer', 'skin']",12,"season 4","mockingbird","stabbed in the chest by arya stark with needle.",37,"None",1,0,1
"95","ryger rivers","2011-06-12","Season 1","Baelor","father, please â","father please â","['father', 'please', 'â']",9,NA,NA,NA,NA,"None",1,0,0
"96","sandor clegane","2011-04-17","Season 1","Winter is Coming","rough night, imp?","rough night imp","['rough', 'night', 'imp']",1,"season 8","the bells ","sacrificed himself to kill the mountain by tackling him into a pit of fire.",NA,"None",1,1,0
"97","sansa stark","2011-04-17","Season 1","Winter is Coming","thank you.","thank","['thank']",1,NA,NA,NA,NA,"Stark",0,1,0
"98","shae","2011-06-12","Season 1","Baelor","ls that why l'm here? so we can talk about our mothers?","l l'm talk mother","['l', ""l'm"", 'talk', 'mother']",9,"season 4","the children","strangled to death by tyrion lannister with a chain for betraying him and helping tywin attempt to kill him.",40,"Lannister",0,0,1
"99","shagga","2011-06-05","Season 1","The Pointy End","best for tyrion son of tywin. not best for me.","best tyrion son tywin best","['best', 'tyrion', 'son', 'tywin', 'best']",8,NA,NA,NA,NA,"Lannister",1,0,0
"100","stevron frey","2011-06-12","Season 1","Baelor","father, you forget yourself. lady stark is â","father forget lady stark â","['father', 'forget', 'lady', 'stark', 'â']",9,NA,NA,NA,NA,"Stark",1,1,0
"101","styr","2014-04-06","Season 4","Two Swords","why does the meat down here taste so much better than it does on our side of the wall?","meat taste much better side wall","['meat', 'taste', 'much', 'better', 'side', 'wall']",31,"season 4","the watchers on the wall","head smashed open with a hammer by jon snow, during the battle of castle black.",39,"Wildling",1,1,1
"102","syrio forel","2011-05-01","Season 1","Lord Snow","you are late, boy. tomorrow you will be here at midday.","late boy tomorrow midday","['late', 'boy', 'tomorrow', 'midday']",3,"season 1","the pointy end","stabbed off-screen by meryn trant with his sword.",8,"House Stark",1,0,1
"103","theon greyjoy","2011-04-17","Season 1","Winter is Coming","mountain lion?","mountain lion","['mountain', 'lion']",1,"season 8","the long night ","stabbed in the abdomen by the night king, with the broken shaft of his own spear.",NA,"House Greyjoy",1,1,0
"104","thoros","2013-04-07","Season 3","Dark Wings, Dark Words","a lion still has claws...","lion still claw","['lion', 'still', 'claw']",22,"season 7","beyond the wall ","died from a combination of wounds sustained from the polar bear wight attack, and hypothermia.",66,"None",1,0,1
"105","tickler","2012-04-22","Season 2","Garden of Bones","is there gold and silver in the village?","gold silver village","['gold', 'silver', 'village']",14,"season 2","ghost of harrenhal","neck snapped by jaqen h'ghar, on arya's orders.",15,"Lannister",1,0,1
"106","timett","2012-04-15","Season 2","What Is Dead May Never Die","there are no goats, halfman.","goat halfman","['goat', 'halfman']",13,NA,NA,NA,NA,"Lannister",1,0,0
"107","tobho mott","2011-05-08","Season 1","Cripples, Bastards and Broken Things","the former hand did call on me, my lord, several times. i regret to say he did not honor me with his patronage.","former hand call lord several time regret say honor patronage","['former', 'hand', 'call', 'lord', 'several', 'time', 'regret', 'say', 'honor', 'patronage']",4,NA,NA,NA,NA,"None",1,0,0
"108","tomard","2011-05-29","Season 1","You Win or You Die","yes, my lord.","yes lord","['yes', 'lord']",7,NA,NA,NA,NA,"House Stark",1,0,0
"109","tormund","2013-03-31","Season 3","Valar Dohaeris","i smell a crow.","smell crow","['smell', 'crow']",21,NA,NA,NA,NA,"Wildling",1,1,0
"110","tyrion lannister","2011-04-17","Season 1","Winter is Coming","mmh. it is true what they say about the northern girls.","mmh true say northern girl","['mmh', 'true', 'say', 'northern', 'girl']",1,NA,NA,NA,NA,"Lannister",1,1,0
"111","tywin lannister","2011-05-29","Season 1","You Win or You Die","attacking him was stupid.","attacking stupid","['attacking', 'stupid']",7,"season 4","the children","shot in the heart by tyrion lannister with joffrey's crossbow for trying to kill him and sleeping with shae.",40,"House Lannister",1,1,1
"112","vardis egen","2011-05-15","Season 1","The Wolf and the Lion","you are far from home, lady stark.","far home lady stark","['far', 'home', 'lady', 'stark']",5,"season 1","a golden crown","stabbed in the throat by bronn with his sword in a trial by combat under tyrion lannister.",6,"Arryn",1,0,1
"113","varys","2011-05-01","Season 1","Lord Snow","lord stark.","lord stark","['lord', 'stark']",3,"season 8","the bells ","burned alive by drogon on daenerys orders for plotting treason against her.",NA,"Targaryen",1,0,0
"114","viserys targaryen","2011-04-24","Season 1","The Kingsroad","i have no interest in hospitality or comfort. i will stay with drogo until he fulfils his end of the bargain and i have my crown.","interest hospitality comfort stay drogo fulfils end bargain crown","['interest', 'hospitality', 'comfort', 'stay', 'drogo', 'fulfils', 'end', 'bargain', 'crown']",2,"season 1","a golden crown","crowned with molten gold by khal drogo, after threatening daenerys.",6,"House Targaryen",1,1,1
"115","waif","2015-04-26","Season 5","High Sparrow","who are you?","","[]",43,"season 6","no one","stabbed in the face by arya stark with needle.",58,"None",0,0,1
"116","walder frey","2011-06-12","Season 1","Baelor","what do you want?","want","['want']",9,"season 6","the winds of winter","throat sliced open by arya stark with a dagger, as revenge for what he had ordered to happen at the red wedding.",60,"None",1,1,1
"117","waymar royce","2011-04-17","Season 1","Winter is Coming","what do you expect? they are savages. one lot steals a goat from another lot and before you know it, they are ripping each other to pieces.","expect savage one lot steal goat another lot know ripping piece","['expect', 'savage', 'one', 'lot', 'steal', 'goat', 'another', 'lot', 'know', 'ripping', 'piece']",1,"season 1","winter is coming","slashed by a white walker with an ice blade.",1,"Night's Watch",1,1,1
"118","will","2011-04-17","Season 1","Winter is Coming","i have never seen wildlings do a thing like this. i have never seen a thing like this, not ever in my life.","never seen wildlings thing like never seen thing like ever life","['never', 'seen', 'wildlings', 'thing', 'like', 'never', 'seen', 'thing', 'like', 'ever', 'life']",1,"season 1","winter is coming","beheaded by ned stark with his greatsword ice for deserting the nights watch.",1,"Night's Watch",1,0,1
"119","ygritte","2012-05-06","Season 2","The Old Gods and the New","ygritte.","ygritte","['ygritte']",16,"season 4","the watchers on the wall","shot in the heart with an arrow by olly, during the battle of castle black.",39,"Wildling",0,0,1
"120","yohn royce","2015-04-12","Season 5","The Wars to Come","my sons have had swords in their hands from the time they could walk. this oneâ¦","son sword hand time could walk oneâ","['son', 'sword', 'hand', 'time', 'could', 'walk', 'oneâ']",41,NA,NA,NA,NA,"Arryn",1,1,0
"121","yoren","2011-05-01","Season 1","Lord Snow","a bear's balls.","bear's ball","[""bear's"", 'ball']",3,"season 2","what is dead may never die","stabbed in the back of the neck by amory loch with a sword.",13,"Night's Watch",1,0,1
